root@lamp-ubuntu-s-1vcpu-1gb-tor1-01:~# tcpdump -n -i eth0
00:31:36.325209 IP 159.203.13.120.22 > 99.238.17.64.57217: Flags [P.], seq 1527820:1527976, ack 829, win 501, length 156
00:31:36.325405 IP 159.203.13.120.22 > 99.238.17.64.57217: Flags [P.], seq 1527976:1528132, ack 829, win 501, length 156
00:31:36.325596 IP 159.203.13.120.22 > 99.238.17.64.57217: Flags [P.], seq 1528132:1528288, ack 829, win 501, length 156
00:31:36.325787 IP 159.203.13.120.22 > 99.238.17.64.57217: Flags [P.], seq 1528288:1528444, ack 829, win 501, length 156
00:31:36.326023 IP 159.203.13.120.22 > 99.238.17.64.57217: Flags [P.], seq 1528444:1528600, ack 829, win 501, length 156
00:31:36.326219 IP 159.203.13.120.22 > 99.238.17.64.57217: Flags [P.], seq 1528600:1528756, ack 829, win 501, length 156
00:31:36.326417 IP 159.203.13.120.22 > 99.238.17.64.57217: Flags [P.], seq 1528756:1528912, ack 829, win 501, length 156
00:31:36.326660 IP 99.238.17.64.57217 > 159.203.13.120.22: Flags [P.], seq 829:865, ack 1514920, win 2062, length 36
00:31:36.326661 IP 99.238.17.64.57217 > 159.203.13.120.22: Flags [.], ack 1515232, win 2060, length 0
00:31:36.326661 IP 99.238.17.64.57217 > 159.203.13.120.22: Flags [.], ack 1524176, win 2064, length 0
00:31:36.326929 IP 159.203.13.120.22 > 99.238.17.64.57217: Flags [P.], seq 1528912:1529068, ack 865, win 501, length 156
00:31:36.327071 IP 159.203.13.120.22 > 99.238.17.64.57217: Flags [P.], seq 1529068:1529432, ack 865, win 501, length 364
00:31:36.327308 IP 159.203.13.120.22 > 99.238.17.64.57217: Flags [P.], seq 1529432:1529716, ack 865, win 501, length 284
00:31:36.327559 IP 159.203.13.120.22 > 99.238.17.64.57217: Flags [P.], seq 1529716:1529872, ack 865, win 501, length 156
00:31:36.327758 IP 159.203.13.120.22 > 99.238.17.64.57217: Flags [P.], seq 1529872:1530028, ack 865, win 501, length 156
00:31:36.327950 IP 159.203.13.120.22 > 99.238.17.64.57217: Flags [P.], seq 1530028:1530184, ack 865, win 501, length 156
00:31:36.328144 IP 159.203.13.120.22 > 99.238.17.64.57217: Flags [P.], seq 1530184:1530340, ack 865, win 501, length 156
00:31:36.328342 IP 159.203.13.120.22 > 99.238.17.64.57217: Flags [P.], seq 1530340:1530496, ack 865, win 501, length 156
00:31:36.328544 IP 159.203.13.120.22 > 99.238.17.64.57217: Flags [P.], seq 1530496:1530652, ack 865, win 501, length 156
00:31:36.328731 IP 159.203.13.120.22 > 99.238.17.64.57217: Flags [P.], seq 1530652:1530808, ack 865, win 501, length 156
00:31:36.328925 IP 159.203.13.120.22 > 99.238.17.64.57217: Flags [P.], seq 1530808:1530964, ack 865, win 501, length 156
00:31:36.329122 IP 159.203.13.120.22 > 99.238.17.64.57217: Flags [P.], seq 1530964:1531120, ack 865, win 501, length 156
00:31:36.329311 IP 159.203.13.120.22 > 99.238.17.64.57217: Flags [P.], seq 1531120:1531276, ack 865, win 501, length 156
00:31:36.329510 IP 159.203.13.120.22 > 99.238.17.64.57217: Flags [P.], seq 1531276:1531432, ack 865, win 501, length 156
00:31:36.329700 IP 159.203.13.120.22 > 99.238.17.64.57217: Flags [P.], seq 1531432:1531588, ack 865, win 501, length 156
00:31:36.329890 IP 159.203.13.120.22 > 99.238.17.64.57217: Flags [P.], seq 1531588:1531744, ack 865, win 501, length 156
00:31:36.330106 IP 159.203.13.120.22 > 99.238.17.64.57217: Flags [P.], seq 1531744:1531900, ack 865, win 501, length 156
00:31:36.330305 IP 159.203.13.120.22 > 99.238.17.64.57217: Flags [P.], seq 1531900:1532056, ack 865, win 501, length 156
00:31:36.330504 IP 159.203.13.120.22 > 99.238.17.64.57217: Flags [P.], seq 1532056:1532212, ack 865, win 501, length 156
00:31:36.330700 IP 159.203.13.120.22 > 99.238.17.64.57217: Flags [P.], seq 1532212:1532368, ack 865, win 501, length 156
00:31:36.330889 IP 159.203.13.120.22 > 99.238.17.64.57217: Flags [P.], seq 1532368:1532524, ack 865, win 501, length 156
00:31:36.331092 IP 159.203.13.120.22 > 99.238.17.64.57217: Flags [P.], seq 1532524:1532680, ack 865, win 501, length 156
00:31:36.331326 IP 159.203.13.120.22 > 99.238.17.64.57217: Flags [P.], seq 1532680:1532836, ack 865, win 501, length 156
00:31:36.331581 IP 159.203.13.120.22 > 99.238.17.64.57217: Flags [P.], seq 1532836:1532992, ack 865, win 501, length 156
00:31:36.331776 IP 159.203.13.120.22 > 99.238.17.64.57217: Flags [P.], seq 1532992:1533148, ack 865, win 501, length 156
00:31:36.331973 IP 159.203.13.120.22 > 99.238.17.64.57217: Flags [P.], seq 1533148:1533304, ack 865, win 501, length 156
00:31:36.332170 IP 159.203.13.120.22 > 99.238.17.64.57217: Flags [P.], seq 1533304:1533460, ack 865, win 501, length 156
00:31:36.332365 IP 159.203.13.120.22 > 99.238.17.64.57217: Flags [P.], seq 1533460:1533616, ack 865, win 501, length 156
00:31:36.332561 IP 159.203.13.120.22 > 99.238.17.64.57217: Flags [P.], seq 1533616:1533772, ack 865, win 501, length 156
00:31:36.332760 IP 159.203.13.120.22 > 99.238.17.64.57217: Flags [P.], seq 1533772:1533928, ack 865, win 501, length 156
00:31:36.332954 IP 159.203.13.120.22 > 99.238.17.64.57217: Flags [P.], seq 1533928:1534084, ack 865, win 501, length 156
00:31:36.333150 IP 159.203.13.120.22 > 99.238.17.64.57217: Flags [P.], seq 1534084:1534240, ack 865, win 501, length 156
00:31:36.333354 IP 159.203.13.120.22 > 99.238.17.64.57217: Flags [P.], seq 1534240:1534396, ack 865, win 501, length 156
00:31:36.333547 IP 159.203.13.120.22 > 99.238.17.64.57217: Flags [P.], seq 1534396:1534552, ack 865, win 501, length 156
00:31:36.333741 IP 159.203.13.120.22 > 99.238.17.64.57217: Flags [P.], seq 1534552:1534708, ack 865, win 501, length 156
00:31:36.333955 IP 159.203.13.120.22 > 99.238.17.64.57217: Flags [P.], seq 1534708:1534864, ack 865, win 501, length 156
00:31:36.334147 IP 159.203.13.120.22 > 99.238.17.64.57217: Flags [P.], seq 1534864:1535020, ack 865, win 501, length 156
00:31:36.334344 IP 159.203.13.120.22 > 99.238.17.64.57217: Flags [P.], seq 1535020:1535176, ack 865, win 501, length 156
00:31:36.334534 IP 159.203.13.120.22 > 99.238.17.64.57217: Flags [P.], seq 1535176:1535332, ack 865, win 501, length 156
00:31:36.334735 IP 159.203.13.120.22 > 99.238.17.64.57217: Flags [P.], seq 1535332:1535488, ack 865, win 501, length 156
00:31:36.334958 IP 99.238.17.64.57217 > 159.203.13.120.22: Flags [.], ack 1530028, win 2063, length 0
00:31:36.334992 IP 159.203.13.120.22 > 99.238.17.64.57217: Flags [P.], seq 1535488:1535644, ack 865, win 501, length 156
00:31:36.335252 IP 159.203.13.120.22 > 99.238.17.64.57217: Flags [P.], seq 1535644:1535904, ack 865, win 501, length 260
00:31:36.335490 IP 159.203.13.120.22 > 99.238.17.64.57217: Flags [P.], seq 1535904:1536060, ack 865, win 501, length 156
00:31:36.335670 IP 159.203.13.120.22 > 99.238.17.64.57217: Flags [P.], seq 1536060:1536216, ack 865, win 501, length 156
00:31:36.335838 IP 159.203.13.120.22 > 99.238.17.64.57217: Flags [P.], seq 1536216:1536372, ack 865, win 501, length 156
00:31:36.336013 IP 159.203.13.120.22 > 99.238.17.64.57217: Flags [P.], seq 1536372:1536528, ack 865, win 501, length 156
00:31:36.336186 IP 159.203.13.120.22 > 99.238.17.64.57217: Flags [P.], seq 1536528:1536684, ack 865, win 501, length 156
00:31:36.336360 IP 159.203.13.120.22 > 99.238.17.64.57217: Flags [P.], seq 1536684:1536840, ack 865, win 501, length 156
00:31:36.336532 IP 159.203.13.120.22 > 99.238.17.64.57217: Flags [P.], seq 1536840:1536996, ack 865, win 501, length 156
00:31:36.336701 IP 159.203.13.120.22 > 99.238.17.64.57217: Flags [P.], seq 1536996:1537152, ack 865, win 501, length 156
00:31:36.336869 IP 159.203.13.120.22 > 99.238.17.64.57217: Flags [P.], seq 1537152:1537308, ack 865, win 501, length 156
00:31:36.336997 IP 159.203.13.120.22 > 99.238.17.64.57217: Flags [P.], seq 1537308:1537464, ack 865, win 501, length 156
00:31:36.337115 IP 159.203.13.120.22 > 99.238.17.64.57217: Flags [P.], seq 1537464:1537620, ack 865, win 501, length 156
00:31:36.337240 IP 159.203.13.120.22 > 99.238.17.64.57217: Flags [P.], seq 1537620:1537776, ack 865, win 501, length 156
00:31:36.337359 IP 159.203.13.120.22 > 99.238.17.64.57217: Flags [P.], seq 1537776:1537932, ack 865, win 501, length 156
00:31:36.337476 IP 159.203.13.120.22 > 99.238.17.64.57217: Flags [P.], seq 1537932:1538088, ack 865, win 501, length 156
00:31:36.337589 IP 159.203.13.120.22 > 99.238.17.64.57217: Flags [P.], seq 1538088:1538244, ack 865, win 501, length 156
00:31:36.337709 IP 159.203.13.120.22 > 99.238.17.64.57217: Flags [P.], seq 1538244:1538400, ack 865, win 501, length 156
00:31:36.337829 IP 159.203.13.120.22 > 99.238.17.64.57217: Flags [P.], seq 1538400:1538556, ack 865, win 501, length 156
00:31:36.337983 IP 159.203.13.120.22 > 99.238.17.64.57217: Flags [P.], seq 1538556:1538712, ack 865, win 501, length 156
00:31:36.338109 IP 159.203.13.120.22 > 99.238.17.64.57217: Flags [P.], seq 1538712:1538868, ack 865, win 501, length 156
00:31:36.338232 IP 159.203.13.120.22 > 99.238.17.64.57217: Flags [P.], seq 1538868:1539024, ack 865, win 501, length 156
00:31:36.338356 IP 159.203.13.120.22 > 99.238.17.64.57217: Flags [P.], seq 1539024:1539180, ack 865, win 501, length 156
00:31:36.338472 IP 159.203.13.120.22 > 99.238.17.64.57217: Flags [P.], seq 1539180:1539336, ack 865, win 501, length 156
00:31:36.338596 IP 159.203.13.120.22 > 99.238.17.64.57217: Flags [P.], seq 1539336:1539492, ack 865, win 501, length 156
00:31:36.338715 IP 159.203.13.120.22 > 99.238.17.64.57217: Flags [P.], seq 1539492:1539648, ack 865, win 501, length 156
00:31:36.338834 IP 159.203.13.120.22 > 99.238.17.64.57217: Flags [P.], seq 1539648:1539804, ack 865, win 501, length 156
00:31:36.338974 IP 159.203.13.120.22 > 99.238.17.64.57217: Flags [P.], seq 1539804:1539960, ack 865, win 501, length 156
00:31:36.339130 IP 159.203.13.120.22 > 99.238.17.64.57217: Flags [P.], seq 1539960:1540116, ack 865, win 501, length 156
00:31:36.339304 IP 159.203.13.120.22 > 99.238.17.64.57217: Flags [P.], seq 1540116:1540272, ack 865, win 501, length 156
00:31:36.339473 IP 159.203.13.120.22 > 99.238.17.64.57217: Flags [P.], seq 1540272:1540428, ack 865, win 501, length 156
00:31:36.339707 IP 159.203.13.120.57286 > 0.0.0.22.13: Flags [S], seq 4127795405, win 64240, options [mss 1460,sackOK,TS val 3028084160 ecr 0,nop,wscale 7], length 0
00:31:36.339887 IP 159.203.13.120.51678 > 0.0.0.22.117: Flags [S], seq 3015714546, win 64240, options [mss 1460,sackOK,TS val 3028084160 ecr 0,nop,wscale 7], length 0
00:31:36.340109 IP 159.203.13.120.22 > 99.238.17.64.57217: Flags [P.], seq 1540428:1540920, ack 865, win 501, length 492
00:31:36.340237 IP 159.203.13.120.22 > 99.238.17.64.57217: Flags [P.], seq 1540920:1541076, ack 865, win 501, length 156
00:31:36.340366 IP 159.203.13.120.22 > 99.238.17.64.57217: Flags [P.], seq 1541076:1541232, ack 865, win 501, length 156
00:31:36.340486 IP 159.203.13.120.22 > 99.238.17.64.57217: Flags [P.], seq 1541232:1541388, ack 865, win 501, length 156
00:31:36.340606 IP 159.203.13.120.22 > 99.238.17.64.57217: Flags [P.], seq 1541388:1541544, ack 865, win 501, length 156
00:31:36.340729 IP 159.203.13.120.22 > 99.238.17.64.57217: Flags [P.], seq 1541544:1541700, ack 865, win 501, length 156
00:31:36.340848 IP 159.203.13.120.22 > 99.238.17.64.57217: Flags [P.], seq 1541700:1541856, ack 865, win 501, length 156
00:31:36.340965 IP 159.203.13.120.22 > 99.238.17.64.57217: Flags [P.], seq 1541856:1542012, ack 865, win 501, length 156
00:31:36.341081 IP 159.203.13.120.22 > 99.238.17.64.57217: Flags [P.], seq 1542012:1542168, ack 865, win 501, length 156
00:31:36.341202 IP 159.203.13.120.22 > 99.238.17.64.57217: Flags [P.], seq 1542168:1542324, ack 865, win 501, length 156
00:31:36.341322 IP 159.203.13.120.22 > 99.238.17.64.57217: Flags [P.], seq 1542324:1542480, ack 865, win 501, length 156
00:31:36.341436 IP 99.238.17.64.57217 > 159.203.13.120.22: Flags [.], ack 1532992, win 2064, length 0
00:31:36.341542 IP 159.203.13.120.22 > 99.238.17.64.57217: Flags [P.], seq 1542480:1542636, ack 865, win 501, length 156
00:31:36.341682 IP 159.203.13.120.22 > 99.238.17.64.57217: Flags [P.], seq 1542636:1542776, ack 865, win 501, length 140
00:31:36.341798 IP 159.203.13.120.22 > 99.238.17.64.57217: Flags [P.], seq 1542776:1542932, ack 865, win 501, length 156
00:31:36.341859 IP 159.203.13.120.22 > 99.238.17.64.57217: Flags [P.], seq 1542932:1543088, ack 865, win 501, length 156
00:31:36.342051 IP 159.203.13.120.22 > 99.238.17.64.57217: Flags [P.], seq 1543088:1543372, ack 865, win 501, length 284
00:31:36.342178 IP 159.203.13.120.22 > 99.238.17.64.57217: Flags [P.], seq 1543372:1543528, ack 865, win 501, length 156
00:31:36.342295 IP 159.203.13.120.22 > 99.238.17.64.57217: Flags [P.], seq 1543528:1543684, ack 865, win 501, length 156
00:31:36.342420 IP 159.203.13.120.22 > 99.238.17.64.57217: Flags [P.], seq 1543684:1543840, ack 865, win 501, length 156
00:31:36.342535 IP 159.203.13.120.22 > 99.238.17.64.57217: Flags [P.], seq 1543840:1543996, ack 865, win 501, length 156
00:31:36.342650 IP 159.203.13.120.22 > 99.238.17.64.57217: Flags [P.], seq 1543996:1544152, ack 865, win 501, length 156
00:31:36.342769 IP 159.203.13.120.22 > 99.238.17.64.57217: Flags [P.], seq 1544152:1544308, ack 865, win 501, length 156
00:31:36.342891 IP 159.203.13.120.22 > 99.238.17.64.57217: Flags [P.], seq 1544308:1544464, ack 865, win 501, length 156
00:31:36.343010 IP 159.203.13.120.22 > 99.238.17.64.57217: Flags [P.], seq 1544464:1544620, ack 865, win 501, length 156
00:31:36.343131 IP 159.203.13.120.22 > 99.238.17.64.57217: Flags [P.], seq 1544620:1544776, ack 865, win 501, length 156
00:31:36.343249 IP 159.203.13.120.22 > 99.238.17.64.57217: Flags [P.], seq 1544776:1544932, ack 865, win 501, length 156
00:31:36.343877 IP 159.203.13.120.22 > 99.238.17.64.57217: Flags [P.], seq 1544932:1545088, ack 865, win 501, length 156
00:31:36.344031 IP 159.203.13.120.22 > 99.238.17.64.57217: Flags [P.], seq 1545088:1545244, ack 865, win 501, length 156
00:31:36.344162 IP 159.203.13.120.22 > 99.238.17.64.57217: Flags [P.], seq 1545244:1545400, ack 865, win 501, length 156
00:31:36.344288 IP 159.203.13.120.22 > 99.238.17.64.57217: Flags [P.], seq 1545400:1545556, ack 865, win 501, length 156
00:31:36.344414 IP 159.203.13.120.22 > 99.238.17.64.57217: Flags [P.], seq 1545556:1545712, ack 865, win 501, length 156
00:31:36.344538 IP 159.203.13.120.22 > 99.238.17.64.57217: Flags [P.], seq 1545712:1545868, ack 865, win 501, length 156
00:31:36.344671 IP 159.203.13.120.22 > 99.238.17.64.57217: Flags [P.], seq 1545868:1546024, ack 865, win 501, length 156
00:31:36.344795 IP 159.203.13.120.22 > 99.238.17.64.57217: Flags [P.], seq 1546024:1546180, ack 865, win 501, length 156
00:31:36.344919 IP 159.203.13.120.22 > 99.238.17.64.57217: Flags [P.], seq 1546180:1546336, ack 865, win 501, length 156
00:31:36.345042 IP 159.203.13.120.22 > 99.238.17.64.57217: Flags [P.], seq 1546336:1546492, ack 865, win 501, length 156
00:31:36.345165 IP 159.203.13.120.22 > 99.238.17.64.57217: Flags [P.], seq 1546492:1546648, ack 865, win 501, length 156
00:31:36.345287 IP 159.203.13.120.22 > 99.238.17.64.57217: Flags [P.], seq 1546648:1546804, ack 865, win 501, length 156
00:31:36.345411 IP 159.203.13.120.22 > 99.238.17.64.57217: Flags [P.], seq 1546804:1546960, ack 865, win 501, length 156
00:31:36.345534 IP 159.203.13.120.22 > 99.238.17.64.57217: Flags [P.], seq 1546960:1547116, ack 865, win 501, length 156
00:31:36.345653 IP 159.203.13.120.22 > 99.238.17.64.57217: Flags [P.], seq 1547116:1547272, ack 865, win 501, length 156
00:31:36.345776 IP 159.203.13.120.22 > 99.238.17.64.57217: Flags [P.], seq 1547272:1547428, ack 865, win 501, length 156
00:31:36.345892 IP 159.203.13.120.22 > 99.238.17.64.57217: Flags [P.], seq 1547428:1547584, ack 865, win 501, length 156
00:31:36.346046 IP 159.203.13.120.22 > 99.238.17.64.57217: Flags [P.], seq 1547584:1547740, ack 865, win 501, length 156
00:31:36.346170 IP 159.203.13.120.22 > 99.238.17.64.57217: Flags [P.], seq 1547740:1547896, ack 865, win 501, length 156
00:31:36.346292 IP 159.203.13.120.22 > 99.238.17.64.57217: Flags [P.], seq 1547896:1548052, ack 865, win 501, length 156
00:31:36.346409 IP 159.203.13.120.22 > 99.238.17.64.57217: Flags [P.], seq 1548052:1548208, ack 865, win 501, length 156
00:31:36.346526 IP 159.203.13.120.22 > 99.238.17.64.57217: Flags [P.], seq 1548208:1548364, ack 865, win 501, length 156
00:31:36.346650 IP 159.203.13.120.22 > 99.238.17.64.57217: Flags [P.], seq 1548364:1548520, ack 865, win 501, length 156
00:31:36.346770 IP 159.203.13.120.22 > 99.238.17.64.57217: Flags [P.], seq 1548520:1548676, ack 865, win 501, length 156
00:31:36.346888 IP 159.203.13.120.22 > 99.238.17.64.57217: Flags [P.], seq 1548676:1548832, ack 865, win 501, length 156
00:31:36.347011 IP 159.203.13.120.22 > 99.238.17.64.57217: Flags [P.], seq 1548832:1548988, ack 865, win 501, length 156
00:31:36.347184 IP 159.203.13.120.22 > 99.238.17.64.57217: Flags [P.], seq 1548988:1549144, ack 865, win 501, length 156
00:31:36.347380 IP 159.203.13.120.22 > 99.238.17.64.57217: Flags [P.], seq 1549144:1549300, ack 865, win 501, length 156
00:31:36.347569 IP 159.203.13.120.22 > 99.238.17.64.57217: Flags [P.], seq 1549300:1549456, ack 865, win 501, length 156
00:31:36.347700 IP 159.203.13.120.22 > 99.238.17.64.57217: Flags [P.], seq 1549456:1549612, ack 865, win 501, length 156
00:31:36.347818 IP 159.203.13.120.22 > 99.238.17.64.57217: Flags [P.], seq 1549612:1549768, ack 865, win 501, length 156
00:31:36.347940 IP 159.203.13.120.22 > 99.238.17.64.57217: Flags [P.], seq 1549768:1549924, ack 865, win 501, length 156
00:31:36.348057 IP 159.203.13.120.22 > 99.238.17.64.57217: Flags [P.], seq 1549924:1550080, ack 865, win 501, length 156
00:31:36.348174 IP 159.203.13.120.22 > 99.238.17.64.57217: Flags [P.], seq 1550080:1550236, ack 865, win 501, length 156
00:31:36.348293 IP 159.203.13.120.22 > 99.238.17.64.57217: Flags [P.], seq 1550236:1550392, ack 865, win 501, length 156
00:31:36.348417 IP 159.203.13.120.22 > 99.238.17.64.57217: Flags [P.], seq 1550392:1550548, ack 865, win 501, length 156
00:31:36.348495 IP 99.238.17.64.57217 > 159.203.13.120.22: Flags [.], ack 1544620, win 2064, length 0
00:31:36.348655 IP 159.203.13.120.22 > 99.238.17.64.57217: Flags [P.], seq 1550548:1550808, ack 865, win 501, length 260
00:31:36.348793 IP 159.203.13.120.22 > 99.238.17.64.57217: Flags [P.], seq 1550808:1550964, ack 865, win 501, length 156
00:31:36.348915 IP 159.203.13.120.22 > 99.238.17.64.57217: Flags [P.], seq 1550964:1551120, ack 865, win 501, length 156
00:31:36.349035 IP 159.203.13.120.22 > 99.238.17.64.57217: Flags [P.], seq 1551120:1551276, ack 865, win 501, length 156
00:31:36.349181 IP 159.203.13.120.22 > 99.238.17.64.57217: Flags [P.], seq 1551276:1551432, ack 865, win 501, length 156
00:31:36.349304 IP 159.203.13.120.22 > 99.238.17.64.57217: Flags [P.], seq 1551432:1551588, ack 865, win 501, length 156
00:31:36.349448 IP 159.203.13.120.22 > 99.238.17.64.57217: Flags [P.], seq 1551588:1551744, ack 865, win 501, length 156
00:31:36.349565 IP 159.203.13.120.22 > 99.238.17.64.57217: Flags [P.], seq 1551744:1551900, ack 865, win 501, length 156
00:31:36.349685 IP 159.203.13.120.22 > 99.238.17.64.57217: Flags [P.], seq 1551900:1552056, ack 865, win 501, length 156
00:31:36.349803 IP 159.203.13.120.22 > 99.238.17.64.57217: Flags [P.], seq 1552056:1552212, ack 865, win 501, length 156
00:31:36.349959 IP 159.203.13.120.22 > 99.238.17.64.57217: Flags [P.], seq 1552212:1552368, ack 865, win 501, length 156
00:31:36.350085 IP 159.203.13.120.22 > 99.238.17.64.57217: Flags [P.], seq 1552368:1552524, ack 865, win 501, length 156
00:31:36.350212 IP 159.203.13.120.22 > 99.238.17.64.57217: Flags [P.], seq 1552524:1552680, ack 865, win 501, length 156
00:31:36.350335 IP 159.203.13.120.22 > 99.238.17.64.57217: Flags [P.], seq 1552680:1552836, ack 865, win 501, length 156
00:31:36.350451 IP 159.203.13.120.22 > 99.238.17.64.57217: Flags [P.], seq 1552836:1552992, ack 865, win 501, length 156
00:31:36.350576 IP 159.203.13.120.22 > 99.238.17.64.57217: Flags [P.], seq 1552992:1553148, ack 865, win 501, length 156
00:31:36.350698 IP 159.203.13.120.22 > 99.238.17.64.57217: Flags [P.], seq 1553148:1553304, ack 865, win 501, length 156
00:31:36.350814 IP 159.203.13.120.22 > 99.238.17.64.57217: Flags [P.], seq 1553304:1553460, ack 865, win 501, length 156
00:31:36.350934 IP 159.203.13.120.22 > 99.238.17.64.57217: Flags [P.], seq 1553460:1553616, ack 865, win 501, length 156
00:31:36.351055 IP 159.203.13.120.22 > 99.238.17.64.57217: Flags [P.], seq 1553616:1553772, ack 865, win 501, length 156
00:31:36.351174 IP 159.203.13.120.22 > 99.238.17.64.57217: Flags [P.], seq 1553772:1553928, ack 865, win 501, length 156
00:31:36.351287 IP 159.203.13.120.22 > 99.238.17.64.57217: Flags [P.], seq 1553928:1554084, ack 865, win 501, length 156
00:31:36.351411 IP 159.203.13.120.22 > 99.238.17.64.57217: Flags [P.], seq 1554084:1554240, ack 865, win 501, length 156
00:31:36.351570 IP 159.203.13.120.22 > 99.238.17.64.57217: Flags [P.], seq 1554240:1554396, ack 865, win 501, length 156
00:31:36.351694 IP 159.203.13.120.22 > 99.238.17.64.57217: Flags [P.], seq 1554396:1554552, ack 865, win 501, length 156
00:31:36.351809 IP 159.203.13.120.22 > 99.238.17.64.57217: Flags [P.], seq 1554552:1554708, ack 865, win 501, length 156
00:31:36.351924 IP 159.203.13.120.22 > 99.238.17.64.57217: Flags [P.], seq 1554708:1554864, ack 865, win 501, length 156
00:31:36.352041 IP 159.203.13.120.22 > 99.238.17.64.57217: Flags [P.], seq 1554864:1555020, ack 865, win 501, length 156
00:31:36.352166 IP 159.203.13.120.22 > 99.238.17.64.57217: Flags [P.], seq 1555020:1555176, ack 865, win 501, length 156
00:31:36.352281 IP 159.203.13.120.22 > 99.238.17.64.57217: Flags [P.], seq 1555176:1555332, ack 865, win 501, length 156
00:31:36.352397 IP 159.203.13.120.22 > 99.238.17.64.57217: Flags [P.], seq 1555332:1555488, ack 865, win 501, length 156
00:31:36.352523 IP 159.203.13.120.22 > 99.238.17.64.57217: Flags [P.], seq 1555488:1555644, ack 865, win 501, length 156
00:31:36.352643 IP 159.203.13.120.22 > 99.238.17.64.57217: Flags [P.], seq 1555644:1555800, ack 865, win 501, length 156
00:31:36.352769 IP 159.203.13.120.22 > 99.238.17.64.57217: Flags [P.], seq 1555800:1555956, ack 865, win 501, length 156
00:31:36.352887 IP 159.203.13.120.22 > 99.238.17.64.57217: Flags [P.], seq 1555956:1556112, ack 865, win 501, length 156
00:31:36.353004 IP 159.203.13.120.22 > 99.238.17.64.57217: Flags [P.], seq 1556112:1556268, ack 865, win 501, length 156
00:31:36.353173 IP 159.203.13.120.22 > 99.238.17.64.57217: Flags [P.], seq 1556268:1556424, ack 865, win 501, length 156
00:31:36.353345 IP 159.203.13.120.22 > 99.238.17.64.57217: Flags [P.], seq 1556424:1556580, ack 865, win 501, length 156
00:31:36.353501 IP 159.203.13.120.22 > 99.238.17.64.57217: Flags [P.], seq 1556580:1556736, ack 865, win 501, length 156
00:31:36.353639 IP 159.203.13.120.22 > 99.238.17.64.57217: Flags [P.], seq 1556736:1556892, ack 865, win 501, length 156
00:31:36.353788 IP 159.203.13.120.22 > 99.238.17.64.57217: Flags [P.], seq 1556892:1557048, ack 865, win 501, length 156
00:31:36.353967 IP 159.203.13.120.22 > 99.238.17.64.57217: Flags [P.], seq 1557048:1557204, ack 865, win 501, length 156
00:31:36.354095 IP 159.203.13.120.22 > 99.238.17.64.57217: Flags [P.], seq 1557204:1557360, ack 865, win 501, length 156
00:31:36.354248 IP 159.203.13.120.22 > 99.238.17.64.57217: Flags [P.], seq 1557360:1557516, ack 865, win 501, length 156
00:31:36.354384 IP 159.203.13.120.22 > 99.238.17.64.57217: Flags [P.], seq 1557516:1557672, ack 865, win 501, length 156
00:31:36.354506 IP 159.203.13.120.22 > 99.238.17.64.57217: Flags [P.], seq 1557672:1557828, ack 865, win 501, length 156
00:31:36.354642 IP 159.203.13.120.22 > 99.238.17.64.57217: Flags [P.], seq 1557828:1557984, ack 865, win 501, length 156
00:31:36.354760 IP 159.203.13.120.22 > 99.238.17.64.57217: Flags [P.], seq 1557984:1558140, ack 865, win 501, length 156
00:31:36.354880 IP 159.203.13.120.22 > 99.238.17.64.57217: Flags [P.], seq 1558140:1558296, ack 865, win 501, length 156
00:31:36.355033 IP 159.203.13.120.22 > 99.238.17.64.57217: Flags [P.], seq 1558296:1558452, ack 865, win 501, length 156
00:31:36.355154 IP 159.203.13.120.22 > 99.238.17.64.57217: Flags [P.], seq 1558452:1558608, ack 865, win 501, length 156
00:31:36.355279 IP 159.203.13.120.22 > 99.238.17.64.57217: Flags [P.], seq 1558608:1558764, ack 865, win 501, length 156
00:31:36.355464 IP 159.203.13.120.22 > 99.238.17.64.57217: Flags [P.], seq 1558764:1558920, ack 865, win 501, length 156
00:31:36.355593 IP 159.203.13.120.22 > 99.238.17.64.57217: Flags [P.], seq 1558920:1559076, ack 865, win 501, length 156
00:31:36.355719 IP 159.203.13.120.22 > 99.238.17.64.57217: Flags [P.], seq 1559076:1559232, ack 865, win 501, length 156
00:31:36.355883 IP 159.203.13.120.22 > 99.238.17.64.57217: Flags [P.], seq 1559232:1559388, ack 865, win 501, length 156
00:31:36.356014 IP 159.203.13.120.22 > 99.238.17.64.57217: Flags [P.], seq 1559388:1559544, ack 865, win 501, length 156
00:31:36.356165 IP 159.203.13.120.22 > 99.238.17.64.57217: Flags [P.], seq 1559544:1559700, ack 865, win 501, length 156
00:31:36.356285 IP 159.203.13.120.22 > 99.238.17.64.57217: Flags [P.], seq 1559700:1559856, ack 865, win 501, length 156
00:31:36.356409 IP 159.203.13.120.22 > 99.238.17.64.57217: Flags [P.], seq 1559856:1560012, ack 865, win 501, length 156
00:31:36.356566 IP 159.203.13.120.22 > 99.238.17.64.57217: Flags [P.], seq 1560012:1560168, ack 865, win 501, length 156
00:31:36.356719 IP 159.203.13.120.22 > 99.238.17.64.57217: Flags [P.], seq 1560168:1560324, ack 865, win 501, length 156
00:31:36.356867 IP 159.203.13.120.22 > 99.238.17.64.57217: Flags [P.], seq 1560324:1560480, ack 865, win 501, length 156
00:31:36.356984 IP 99.238.17.64.57217 > 159.203.13.120.22: Flags [.], ack 1544932, win 2063, length 0
00:31:36.357069 IP 159.203.13.120.22 > 99.238.17.64.57217: Flags [P.], seq 1560480:1560636, ack 865, win 501, length 156
00:31:36.357235 IP 159.203.13.120.22 > 99.238.17.64.57217: Flags [P.], seq 1560636:1560896, ack 865, win 501, length 260
00:31:36.357380 IP 159.203.13.120.22 > 99.238.17.64.57217: Flags [P.], seq 1560896:1561052, ack 865, win 501, length 156
00:31:36.357506 IP 159.203.13.120.22 > 99.238.17.64.57217: Flags [P.], seq 1561052:1561208, ack 865, win 501, length 156
00:31:36.357625 IP 159.203.13.120.22 > 99.238.17.64.57217: Flags [P.], seq 1561208:1561364, ack 865, win 501, length 156
00:31:36.357744 IP 159.203.13.120.22 > 99.238.17.64.57217: Flags [P.], seq 1561364:1561520, ack 865, win 501, length 156
00:31:36.357892 IP 159.203.13.120.22 > 99.238.17.64.57217: Flags [P.], seq 1561520:1561676, ack 865, win 501, length 156
00:31:36.358062 IP 159.203.13.120.22 > 99.238.17.64.57217: Flags [P.], seq 1561676:1561832, ack 865, win 501, length 156
00:31:36.358197 IP 159.203.13.120.22 > 99.238.17.64.57217: Flags [P.], seq 1561832:1561988, ack 865, win 501, length 156
00:31:36.358331 IP 159.203.13.120.22 > 99.238.17.64.57217: Flags [P.], seq 1561988:1562144, ack 865, win 501, length 156
00:31:36.358462 IP 159.203.13.120.22 > 99.238.17.64.57217: Flags [P.], seq 1562144:1562300, ack 865, win 501, length 156
00:31:36.358582 IP 159.203.13.120.22 > 99.238.17.64.57217: Flags [P.], seq 1562300:1562456, ack 865, win 501, length 156
00:31:36.358730 IP 159.203.13.120.22 > 99.238.17.64.57217: Flags [P.], seq 1562456:1562612, ack 865, win 501, length 156
00:31:36.358879 IP 159.203.13.120.22 > 99.238.17.64.57217: Flags [P.], seq 1562612:1562768, ack 865, win 501, length 156
00:31:36.359022 IP 159.203.13.120.22 > 99.238.17.64.57217: Flags [P.], seq 1562768:1562924, ack 865, win 501, length 156
00:31:36.359163 IP 159.203.13.120.22 > 99.238.17.64.57217: Flags [P.], seq 1562924:1563080, ack 865, win 501, length 156
00:31:36.359312 IP 159.203.13.120.22 > 99.238.17.64.57217: Flags [P.], seq 1563080:1563236, ack 865, win 501, length 156
00:31:36.359474 IP 159.203.13.120.39486 > 0.0.0.22.166: Flags [S], seq 1767829627, win 64240, options [mss 1460,sackOK,TS val 3028084180 ecr 0,nop,wscale 7], length 0
