root@lamp-ubuntu-s-1vcpu-1gb-tor1-01:~# tcpdump -i eth0 tcp
00:33:37.560485 IP 159.203.13.120.ssh > cpe00fc8d887e03-cm00fc8d887e00.cpe.net.cable.rogers.com.57217: Flags [P.], seq 1406364:1406568, ack 793, win 501, length 204
00:33:37.560601 IP 159.203.13.120.ssh > cpe00fc8d887e03-cm00fc8d887e00.cpe.net.cable.rogers.com.57217: Flags [P.], seq 1406568:1406772, ack 793, win 501, length 204
00:33:37.560715 IP 159.203.13.120.ssh > cpe00fc8d887e03-cm00fc8d887e00.cpe.net.cable.rogers.com.57217: Flags [P.], seq 1406772:1406976, ack 793, win 501, length 204
00:33:37.560827 IP 159.203.13.120.ssh > cpe00fc8d887e03-cm00fc8d887e00.cpe.net.cable.rogers.com.57217: Flags [P.], seq 1406976:1407180, ack 793, win 501, length 204
00:33:37.560944 IP 159.203.13.120.ssh > cpe00fc8d887e03-cm00fc8d887e00.cpe.net.cable.rogers.com.57217: Flags [P.], seq 1407180:1407384, ack 793, win 501, length 204
00:33:37.561061 IP 159.203.13.120.ssh > cpe00fc8d887e03-cm00fc8d887e00.cpe.net.cable.rogers.com.57217: Flags [P.], seq 1407384:1407588, ack 793, win 501, length 204
00:33:37.561174 IP 159.203.13.120.ssh > cpe00fc8d887e03-cm00fc8d887e00.cpe.net.cable.rogers.com.57217: Flags [P.], seq 1407588:1407792, ack 793, win 501, length 204
00:33:37.561298 IP 159.203.13.120.ssh > cpe00fc8d887e03-cm00fc8d887e00.cpe.net.cable.rogers.com.57217: Flags [P.], seq 1407792:1407996, ack 793, win 501, length 204
00:33:37.561414 IP 159.203.13.120.ssh > cpe00fc8d887e03-cm00fc8d887e00.cpe.net.cable.rogers.com.57217: Flags [P.], seq 1407996:1408200, ack 793, win 501, length 204
00:33:37.561530 IP 159.203.13.120.ssh > cpe00fc8d887e03-cm00fc8d887e00.cpe.net.cable.rogers.com.57217: Flags [P.], seq 1408200:1408404, ack 793, win 501, length 204
00:33:37.561641 IP 159.203.13.120.ssh > cpe00fc8d887e03-cm00fc8d887e00.cpe.net.cable.rogers.com.57217: Flags [P.], seq 1408404:1408608, ack 793, win 501, length 204
00:33:37.561766 IP 159.203.13.120.ssh > cpe00fc8d887e03-cm00fc8d887e00.cpe.net.cable.rogers.com.57217: Flags [P.], seq 1408608:1408812, ack 793, win 501, length 204
00:33:37.561942 IP 159.203.13.120.ssh > cpe00fc8d887e03-cm00fc8d887e00.cpe.net.cable.rogers.com.57217: Flags [P.], seq 1408812:1409016, ack 793, win 501, length 204
00:33:37.562131 IP 159.203.13.120.ssh > cpe00fc8d887e03-cm00fc8d887e00.cpe.net.cable.rogers.com.57217: Flags [P.], seq 1409016:1409220, ack 793, win 501, length 204
00:33:37.562351 IP 159.203.13.120.ssh > cpe00fc8d887e03-cm00fc8d887e00.cpe.net.cable.rogers.com.57217: Flags [P.], seq 1409220:1409424, ack 793, win 501, length 204
00:33:37.562513 IP 159.203.13.120.ssh > cpe00fc8d887e03-cm00fc8d887e00.cpe.net.cable.rogers.com.57217: Flags [P.], seq 1409424:1409628, ack 793, win 501, length 204
00:33:37.562639 IP 159.203.13.120.ssh > cpe00fc8d887e03-cm00fc8d887e00.cpe.net.cable.rogers.com.57217: Flags [P.], seq 1409628:1409832, ack 793, win 501, length 204
00:33:37.562752 IP 159.203.13.120.ssh > cpe00fc8d887e03-cm00fc8d887e00.cpe.net.cable.rogers.com.57217: Flags [P.], seq 1409832:1410036, ack 793, win 501, length 204
00:33:37.562868 IP 159.203.13.120.ssh > cpe00fc8d887e03-cm00fc8d887e00.cpe.net.cable.rogers.com.57217: Flags [P.], seq 1410036:1410240, ack 793, win 501, length 204
00:33:37.562986 IP 159.203.13.120.ssh > cpe00fc8d887e03-cm00fc8d887e00.cpe.net.cable.rogers.com.57217: Flags [P.], seq 1410240:1410444, ack 793, win 501, length 204
00:33:37.563138 IP 159.203.13.120.ssh > cpe00fc8d887e03-cm00fc8d887e00.cpe.net.cable.rogers.com.57217: Flags [P.], seq 1410444:1410648, ack 793, win 501, length 204
00:33:37.563317 IP 159.203.13.120.ssh > cpe00fc8d887e03-cm00fc8d887e00.cpe.net.cable.rogers.com.57217: Flags [P.], seq 1410648:1410852, ack 793, win 501, length 204
00:33:37.563490 IP 159.203.13.120.ssh > cpe00fc8d887e03-cm00fc8d887e00.cpe.net.cable.rogers.com.57217: Flags [P.], seq 1410852:1411056, ack 793, win 501, length 204
00:33:37.563614 IP 159.203.13.120.ssh > cpe00fc8d887e03-cm00fc8d887e00.cpe.net.cable.rogers.com.57217: Flags [P.], seq 1411056:1411260, ack 793, win 501, length 204
00:33:37.563732 IP 159.203.13.120.ssh > cpe00fc8d887e03-cm00fc8d887e00.cpe.net.cable.rogers.com.57217: Flags [P.], seq 1411260:1411464, ack 793, win 501, length 204
00:33:37.563852 IP 159.203.13.120.ssh > cpe00fc8d887e03-cm00fc8d887e00.cpe.net.cable.rogers.com.57217: Flags [P.], seq 1411464:1411668, ack 793, win 501, length 204
00:33:37.563964 IP 159.203.13.120.ssh > cpe00fc8d887e03-cm00fc8d887e00.cpe.net.cable.rogers.com.57217: Flags [P.], seq 1411668:1411872, ack 793, win 501, length 204
00:33:37.564075 IP 159.203.13.120.ssh > cpe00fc8d887e03-cm00fc8d887e00.cpe.net.cable.rogers.com.57217: Flags [P.], seq 1411872:1412076, ack 793, win 501, length 204
00:33:37.564196 IP 159.203.13.120.ssh > cpe00fc8d887e03-cm00fc8d887e00.cpe.net.cable.rogers.com.57217: Flags [P.], seq 1412076:1412280, ack 793, win 501, length 204
00:33:37.564310 IP 159.203.13.120.ssh > cpe00fc8d887e03-cm00fc8d887e00.cpe.net.cable.rogers.com.57217: Flags [P.], seq 1412280:1412484, ack 793, win 501, length 204
00:33:37.564430 IP 159.203.13.120.ssh > cpe00fc8d887e03-cm00fc8d887e00.cpe.net.cable.rogers.com.57217: Flags [P.], seq 1412484:1412688, ack 793, win 501, length 204
00:33:37.564546 IP 159.203.13.120.ssh > cpe00fc8d887e03-cm00fc8d887e00.cpe.net.cable.rogers.com.57217: Flags [P.], seq 1412688:1412892, ack 793, win 501, length 204
00:33:37.564658 IP 159.203.13.120.ssh > cpe00fc8d887e03-cm00fc8d887e00.cpe.net.cable.rogers.com.57217: Flags [P.], seq 1412892:1413096, ack 793, win 501, length 204
00:33:37.564773 IP 159.203.13.120.ssh > cpe00fc8d887e03-cm00fc8d887e00.cpe.net.cable.rogers.com.57217: Flags [P.], seq 1413096:1413300, ack 793, win 501, length 204
00:33:37.564980 IP 159.203.13.120.ssh > cpe00fc8d887e03-cm00fc8d887e00.cpe.net.cable.rogers.com.57217: Flags [P.], seq 1413300:1413504, ack 793, win 501, length 204
00:33:37.565153 IP 159.203.13.120.ssh > cpe00fc8d887e03-cm00fc8d887e00.cpe.net.cable.rogers.com.57217: Flags [P.], seq 1413504:1413708, ack 793, win 501, length 204
00:33:37.565288 IP 159.203.13.120.ssh > cpe00fc8d887e03-cm00fc8d887e00.cpe.net.cable.rogers.com.57217: Flags [P.], seq 1413708:1413912, ack 793, win 501, length 204
00:33:37.565409 IP 159.203.13.120.ssh > cpe00fc8d887e03-cm00fc8d887e00.cpe.net.cable.rogers.com.57217: Flags [P.], seq 1413912:1414116, ack 793, win 501, length 204
00:33:37.565530 IP 159.203.13.120.ssh > cpe00fc8d887e03-cm00fc8d887e00.cpe.net.cable.rogers.com.57217: Flags [P.], seq 1414116:1414320, ack 793, win 501, length 204
00:33:37.565642 IP 159.203.13.120.ssh > cpe00fc8d887e03-cm00fc8d887e00.cpe.net.cable.rogers.com.57217: Flags [P.], seq 1414320:1414524, ack 793, win 501, length 204
00:33:37.565757 IP 159.203.13.120.ssh > cpe00fc8d887e03-cm00fc8d887e00.cpe.net.cable.rogers.com.57217: Flags [P.], seq 1414524:1414728, ack 793, win 501, length 204
00:33:37.565869 IP 159.203.13.120.ssh > cpe00fc8d887e03-cm00fc8d887e00.cpe.net.cable.rogers.com.57217: Flags [P.], seq 1414728:1414932, ack 793, win 501, length 204
00:33:37.565986 IP 159.203.13.120.ssh > cpe00fc8d887e03-cm00fc8d887e00.cpe.net.cable.rogers.com.57217: Flags [P.], seq 1414932:1415136, ack 793, win 501, length 204
00:33:37.566136 IP 159.203.13.120.ssh > cpe00fc8d887e03-cm00fc8d887e00.cpe.net.cable.rogers.com.57217: Flags [P.], seq 1415136:1415340, ack 793, win 501, length 204
00:33:37.566254 IP 159.203.13.120.ssh > cpe00fc8d887e03-cm00fc8d887e00.cpe.net.cable.rogers.com.57217: Flags [P.], seq 1415340:1415544, ack 793, win 501, length 204
